{
  "schema_version": "v0",
  "id": "evt-s08-2",
  "evidence_level": "observable_fact",
  "kind": "test_log",
  "summary": "测试日志显示排序相关 6 条用例全部通过。",
  "source_refs": [
    {
      "type": "test_log",
      "ref": "logs/pytest-20260425T1510.txt"
    }
  ],
  "occurred_at": "2026-04-25T15:10:00+08:00"
}
