{
  "schema_version": "v0",
  "id": "evt-s06-2",
  "evidence_level": "observable_fact",
  "kind": "trace_record",
  "summary": "学生追问如何处理成绩缺失的记录后再统计。",
  "source_refs": [
    {
      "type": "trace_record",
      "ref": "trace://opencode/session-s06/turn-4",
      "note": "opencode"
    }
  ],
  "occurred_at": "2026-04-21T19:08:00+08:00"
}
