{
  "schema_version": "v0",
  "id": "evt-s01-2",
  "evidence_level": "observable_fact",
  "kind": "git_commit",
  "summary": "提交 c3d4e5f：改为显式指定 dtype 与千分位处理，而非采用默认类型推断。",
  "source_refs": [
    {
      "type": "git_commit",
      "ref": "c3d4e5f"
    }
  ],
  "occurred_at": "2026-04-10T21:02:00+08:00"
}
