{
  "schema_version": "v0",
  "id": "evt-0002",
  "evidence_level": "observable_fact",
  "kind": "test_log",
  "summary": "既有测试日志显示 12 个用例通过、1 个边界用例失败。",
  "occurred_at": "2026-03-02T15:05:40+08:00",
  "source_refs": [
    {
      "type": "test_log",
      "ref": "logs/pytest-2026-03-02.txt:1-34"
    },
    {
      "type": "file",
      "ref": "tests/test_parser.py",
      "note": "失败用例所在测试文件"
    }
  ]
}
