{
  "schema_version": "v0",
  "id": "evt-s05-1",
  "evidence_level": "observable_fact",
  "kind": "git_commit",
  "summary": "提交 f6a7b8c：新增 tests/test_parser_edge.py，覆盖空行与缺失列用例。",
  "source_refs": [
    {
      "type": "git_commit",
      "ref": "f6a7b8c"
    }
  ],
  "occurred_at": "2026-04-19T20:00:00+08:00"
}
