{
  "schema_version": "v0",
  "id": "evt-s06-1",
  "evidence_level": "observable_fact",
  "kind": "trace_record",
  "summary": "学生询问如何用字典统计课程成绩分布。",
  "source_refs": [
    {
      "type": "trace_record",
      "ref": "trace://opencode/session-s06/turn-2",
      "note": "opencode"
    }
  ],
  "occurred_at": "2026-04-21T19:00:00+08:00"
}
